baslik,icerik
KAHRAMAN ÇORUM,"Yüzbaşı, bölüğüne yeni celp edilen acemi askerlerle tanış - maktadır. Sırası gelen her asker adını soyadını, doğum tari - hi ve memleketini takdim etmektedir. Sırası gelen birisi, memleketinin adını söylerken; “Maraş - lı’yım” der demez Yüzbaşı’dan hatırı sayılır bir şamar yer. Asker neye uğradığını şaşırır, Yüzbaşı hemen gerekçesini açıklar; “-Niye ‘Kahraman Maraşlı’yım’ demiyorsun!” Sıra yanındakine gelmiştir. O da adını, soyadını, doğum ta - rihini söyledikten sonra, -şamar yememek için- ‘Kahraman Çorumlu’yum!” der. Der ama, demesiyle birlikte daha şid - detli bir şamara muhatap olur. Yüzbaşı hiddetlidir; “-Çorum ne zaman ‘Kahraman’ oldu!”  asker-polis fıkraları78 AY’IN TUTULMASI Bir gün Alay Komutanı Albay, alayın eğitim subaylığına ve - kalet eden Yd. Sb. Asteğmen’i çağırarak; “-Gelen bilgilere göre ayın 15’i Cuma gecesi, saat 21.30- 22.30 arasında ‘Ay Tutulması’ olacak. Konuyla ilgili bütün askerlerin bilgilendirilmesi uygun görülmektedir. Bütün bir - liklere haber ver, dediğim saatte,  alayın eğitim sahasında bütün askerler hazır edilsin. Hiçbir aksaklık istemiyorum. Bütün komutanlar, herhangi bir eksikliğin olmaması için yardımcı olsunlar!” Emri alan Eğitim Subayı, Albay’ın emrini vakit geçirmeden Tabur Komutanları olan Yarbay’lara ulaştırır. Yarbaylar, Bölük Komutanları’na, onlar Takım Komutanları’na, Takım Komutanları da Manga Komutanlığı görevini yürüten Ça - vuş veya Onbaşılara Albay’ın emrini tebliğ ederler. Bütün Alay’da bir hareketlenme, bir merak, bir heyecana sebep olan bu tebliğ işlemi, aynı gün kısa zamanda tamamlanır. Ve son komuta kademesindeki Onbaşının birisi hemen mangasını toplar, -birkaç  kademeden geçerek kendisine ulaşan emri,  anladığı şekliyle, - askerlere tebliğ eder; “-Asker! Gelecek Cuma gecesi, saat dokuz buçuk da Alba - yımız Ay’ı tutacakmış. Kendisine Ay’ı tutarken yardım et - mek üzere hepimiz eksiksiz olarak, eğitim sahasında hazır bulunacakmışız! Anlaşıldı mı!”"
VATAN NEYİNİZDİR,"Komutan Mehmet’e soruyor, “- Vatan senin neyindir?” “- Vatan benim anamdır komutanım.” diye bağırıyor. Sıra Osman’a geliyor. “- Vatan senin neyindir asker?” Osman: “- Vatan Mehmet’in anasıdır komutanım!""  kıssa tadında fıkralar79 TEFTİŞ FIRÇASI - ALEFORTENFONİ Albay birliğindeki bölüklerden birisini mevsimlik teftişten geçirmektedir. Her yer tertemiz, yataklar düzgünce katlan - mış, dolaplar tertip düzen içinde, yüzler tıraşlı, potinler bo - yalı… Göze çarpan hiçbir eksiklik yok. Askerler bölüğün önünde, mavzerleri yanlarında… Her askerin özel dolabının kapıları açık, asılı veya katlanmış giyeceklerin dışında tıraş takımları, -hiç kullanılmamış- el - bise fırçası, diş fırçası ve macunu, ayakkabı boyası, tırnak makası…vb. görüşe hazır olarak özel yerlerindedir. Tabur, Bölük, Takım komutanlarıyla birlikte dolaşan Albay bir do - labın önünde durur, sahibi olan askeri çağırtır, diş fırçasını göstererek; “-Bu nedir Mehmet?” der. Mehmetçik cevap verir; “-Teftiş fırçasıdır komitanim!” Albay meseleyi anlar, konuyu kapatıp, dışarıda esas duruş - ta bekleyen askerlerin yanına varır. Selamlaşma seremoni - sinden sonra, bir askere yaklaşır, mavzer namlularının ucu - na takılan ve gece atışlarında kullanılan ‘Alev Örten Honi’yi göstererek; “-Bu nedir Mehmet?” der. Mehmetçik cevap verir; “-Alefotenfoni’dir komutanım.’”"
BİLİYOR AMA SORUYOR,"Acemi birliğindeki erlere komutan soruyor; “-Yüzbaşının rütbe işareti nasıldır?” “-Üsteğmenin rütbe işareti nasıldır?” Asker tutukluk yapıyor, sorulara cevap veremiyor. Arka sı - radaki askerlerden birisi yanındakinin kulağına yaklaşıp, fı - sıldayarak komutan için şöyle diyor: “-Bunların hepsini biliyor da hınzırlığından soruyor!”  asker-polis fıkraları80"
DENETİM,"Genç yaşta emekli olan Albay, evde sürekli oturmaktan, ha - nımıyla ağız dalaşına girmekten sıkılınca, bakkalına gider: “-Sana ayda 200 lira para vereyim, bunun karşılığında seni her gün denetleyeyim!” der. Teklifi cazip bulan bakkal; ‘hem para kazanacağım hem de deneyimli bir albayın uyarısını, yardımını alacağım…’diyerek hemen kabul eder. Emekli albay ertesi gün sabah 08:00’de gelir akşam mesai sonuna kadar bakkal dükkanını denetle - meye başlar. Bakkal, daha bir gün bile geçmeden bu dene - timden sıkılır. Dayanamaz: “-Albayım, al şu 200 liranı, ben bu işten vazgeçtim!” diyerek anlaşmayı bozar. Emekli Albay manav, kasap, kırtasiyeci derken tüm esnafa aynı teklifi yapar. Ancak bir süre sonra hepsi denetimden sıkılarak anlaşmayı bozarlar. Son olarak gittiği hırdavatçı ile yıldızları barışır. Denetim işi aylar sürer. Çok güzel anla - şırlar. Hırdavatçı Albayın her isteğini; “Baş üstüne!” diyerek yerine getirir. Olanlara tam bir anlam veremeyen Albay: “-Yav arkadaş, bütün mahalle esnafı denetimimden sıkıldı. Halbuki seninle gayet iyi çalışıyoruz. Nitekim bu başarımı - zın sana göre sırrı ne?” Hırdavatçı hemen emekli Albay’ın karşısında hazırola geçip derki: “-Albayım, ben de emekli Başçavuşum!”."
İLK YARDIM,"Deniz Kuvvetlerinde acemi erlere eğitim veriliyordu. Denizde boğulma tehlikesi geçirenlere ilk yardım ayrıntıla - rıyla anlatılmıştı. Eğitim çavuşu, bir ere dönerek: “-Anladıkları kısaca tekrar et,” dedi. Acemi er anladığını şöyle özetledi: “-Önce adam sudan çıkarılır,  sonra da su adamdan çıkarılır komutanım.”  kıssa tadında fıkralar81"
TESELLİ,"Kadının biri, oğlunu askere göndermek üzereydi. İki gözü iki çeşme, ağlıyordu. Komşusu geldi ve başladı teselliye: “- Canım, bu ne telaş? Daha ortada fol yok yumurta yok, n’oluyorsun? Bakalım hem oğlunu geri hizmete mi vere - cekler muharip sınıfa mı ayıracaklar... Geri hizmete verir - lerse mesele yok. Ama muharip sınıfa ayrılırsa iki şıktan biri: Ya harp çıkar ya çıkmaz. Harp çıkmazsa ne ala. Ama harp çıkarsa iki şıktan biri: Ya cepheye sevk ederler ya geri hatlarda kalır. Geri hatlarda kalırsa mesele yok. Ama cep - heye sevk ederlerse iki şıktan biri: Ya siperlere gönderirler ya göndermezler. Göndermezlerse mesele yok. Ama gön - derirlerse iki şıktan biri: Ya yaralanır ya yaralanmaz. Yara - lanmazsa ne ala. Ama yaralanırsa iki şıktan biri: Ya ağır ya - rası olur ya hafif. Hafifse ne ala geri gönderirler, askere hiç gitmemiş gibi olur. Ama ağırsa iki şıktan biri: Ya iyileşir ya iyileşmez. İyileşirse mesele yok. Üstelik bir daha da cephe - ye göndermezler. Ama iyileşmezse iki şıktan biri. Ya ölür ya kalır. Ölmezse kendisine kavuşursun. Ama ölürse iki şıktan biri: Ya cennete gider ya cehenneme. Cennete giderse hiç üzülüp göz yaşı dökme kadınım. Cehennemlik bir evlat için de ağlamaya değmez!”"
SİGARA ÖLDÜRÜR,"Komutan askerlerin sigara içmelerine engel olmak için kantinin duvarına bir yazı asmıştır. Yazıda : ‘SİGARA ÖLDÜRÜR!’ diye yazıyormuş. Ertesi gün oradan geçen komutan yazının altında bir not görmüş: ‘Türk askeri ölümden korkmaz!’ İki nimet vardır ki, insanların çoğu onların kıymetlerini hak - kıyla takdir  edememektedirler: Onlardan biri sıhhat, diğeri ise boş vakit...  Hz Muhammed--------------------------------------------------------- asker-polis fıkraları82"
PADİŞAHA SELAMIMI SÖYLEYİN,"Osmanlı’nın son yıllarıdır. Savaşlar birbirine eklenmekte, devamlı toprak ve insan kayıpları yaşanmaktadır. İşte o yıl - larda köylünün birinin beş oğlu olmuş. Evlatlar 18-20 yaş - larına ulaştıkça, -görevleri gereği muhtar ve imamın ilgili şubeye rapor etmelerini müteakip- kısa zamanda jandar - malar gelir, yaşı tutanı ‘şu savaş var bu savaş var...’ diye hemen askere götürürlermiş. İlk dördünde aynı sahneler tekerrür etmiş. Ve maalesef, her gidenin arkasından da faz - la zaman geçmeden ‘Şehadet İlamı’ gelirmiş. Beşinci oğul da askerlik yaşına ulaşınca, köylü bir sabah yine jandarmayı kapısında görür. Tahmin etmiştir ama yine de sorar: “Buyurun, bir durum mu var?” Jandarma; “Senin Osman’ı askere celp etmek için gelmiştik.” Köylü; “Sizi kim gönderdi?” Jandarma; “Biz Pay-i Taht İstanbul’daki Padişahımız Hazretleri’ni temsilen buradayız!” Köylü burnundan solumaktadır, canına tak etmiştir, ne ola - caksa olsun, artık diklenme ve son oğlunu teslim etmeme niyetindedir: “Siz gidin, o İstanbul’daki Padişaha benim selamımı söyle - yin ‘oğlunu da vermedi deyin!’ Bir de deyin ki: ‘Benim belime ( s u l b ü m e )  g ü v e n i p  d e  o n a  b u n a  s a v a ş  i l a n  e d i p  d u r m a s ı n ! ’ ” “Hiç bir zafere çiçekli yollardan gidilmez.”  La Fontaine--------------------------------------------------------- kıssa tadında fıkralar83"
NEYİ GÖRMEMİŞ,"Şoför kullandığı taksiyle “Sağa Dönülmez” işaretine rağ - men sağa saptığı sırada trafik polisinin keskin keskin çalan düdük sesiyle birden yavaşlar, sonra yolun kenarına çekile - rek durur. Trafik polisi elindeki düdüğü sallaya sallaya yü - rüyerek taksinin yanına gelir ve sert bir sesle sorar: “-Dönülmez levhasını görmedin mi?” Şoför, kabahatli olduğunu kabul etmenin duygusu içinde itirafta bulunur: “-Görmesine gördüm de sizi görmedim!”"
ELTİM GİLE,"Kırmızı ışıkta, hiç önemsemeden karşıya geçmekte olan teyzeye polis bağırır; “-Bayan nereye!” Teyze cevap verir; “-Eltim gile gidiyem. Kocam bili, sana ne!” Bize, Asım, ne şunun yumruğu lazım, ne bunun, Birinin pençesi ister yalnız: Kanunun. Mehmet Akif Ersoy--------------------------------------------------------- asker-polis fıkraları84"
POLİS ÇEVİRMESİ,"Mahkemelerindeki dava dosyası onbeş milyonu (nüfusa göre Yaklaşık %20) aşmış, her yıl bir milyona yakın yeni da - vaların açıldığı ülkenin birinde, trafik polis ekibi gecenin bir saatinde çevirme ve emniyet kemer kontrolü yapıyormuş. Bir aracı durdurmuşlar. Polis: “-Tebrikler beyefendi! Bugün emniyet kemeri takan ilk kişi sizsiniz. Size 2000 lira para ödülü veriyoruz. Bu parayla ne yapmayı düşünürsünüz?” Şoför koltuğunda oturan kişi: “-Ehliyet alırım o zaman.” Polis: “-Ehliyetiniz yok mu?” Karısı söze karışır: “-Siz ona bakmayın memur bey, sarhoş da ne dediğini bil - miyor.” Polis şaşın şaşkın bakarken aracın arka koltuğundan bir ses: “-Ben size çalıntı arabayla bu saatte yola çıkmayalım de - medim mi?” Polis tam tepki verecekken, bu sefer de bagajdan bir ses gelir: “-Sınırı geçtik mi?” “Kanunlar  uyusalar bile ölmezler.”  Shakespeare--------------------------------------------------------- kıssa tadında fıkralar85"
FIKRALAR,DOKTOR-HEMŞİRE HASTA-HASTANE
FIKRALARI, doktor fıkraları86
BİR KÖTÜ BİR DE İYİ HABER,"Doktor, yeterince muayene ettikten ve laboratuvar sonuçla - rını inceledikten sonra hastasına; “-Size bir kötü bir de iyi haberim var!” der ve -biraz durak - sayıp- devam eder; “-Önce, kötü haber şu; Maalesef hastalığınız önemli. Mut - laka ameliyatı gerektiriyor. Ancak bu ameliyattan salimen kalkma ihtimali yüz kişide bir.” Bu açıklamayı duyan hastanın morali daha bir bozulur, yüzünün rengi neredeyse beyazlaşır. Hastanın durumunu gözlemlemekte olan doktor; “-Ama sana ‘bir de iyi haberim var’ demiştim; senden önce - ki doksan dokuz kişi ameliyat masasında kaldı!”"
BAŞKA DOKTORA,"Kadın, işten dönen kocasına; “-Sorma hayatım, bugün Doktor Emine Hanım’a gittim. Muayene ettikten sonra ne dedi biliyor musun? Bir ay de - niz sahilinde tatil yapmam gerekiyormuş. Nereye gidelim dersin?” “-Başka doktora gidelim, hayatım!” Söz söylemeyi öğrenmek, kılıç kullanmayı öğrenmekten zordur.  Ahmed ibşihi--------------------------------------------------------- kıssa tadında fıkralar87"
DÖRDÜNÜZ DE Mİ,"Tavsiyelere uymayıp bazı ‘akşam alışkanlıklarını’ terk et - meyen birisinin gözlerindeki cisimleri ‘çift görme’ arazı iler - lemiş. Bütün yaşantısını aksatır duruma gelince, kalkıp bir göz doktoruna gitmiş. Doktor, hasta adamın şikayetini dikkatle dinliyormuş. Has - ta bir yerde ‘durum daha net bir şekilde açıklığa kavuşsun’ diye; “-Doktor Bey, mesela ben sizi şu anda iki kişi gibi görüyo - rum.” der. Burada, doktor hastanın sözünü keser ve sorar. “-Dördünüz de mi öyle çift görüyorsunuz?”"
MESLEKDAŞ,"Hocanın birisi kaza geçirmiş, hastaneye yatırılmış. Günler geçtikçe doktoru ile samimiyeti ilerletmiş. Bir gün doktora; “-Doktorum, aslında seninle ben meslektaşız. Sana da hastalananlar, kaza geçirenler geliyor bana da. Ama sen tedaviyi tam yapmadığından, taburcu ettikten sonra bir ge - len tekrar tekrar gelebiliyor. Fakat bana, genellikle daha ağır hastalar, daha ağır kaza geçirenler geldiği halde, ben onları öyle bir yolcu ediyorum ki, bir daha gelmiyorlar.” Sağlıklı olmak, hayat kavgasında başarının birinci şartıdır. Ahmed Mithad Efendi--------------------------------------------------------- doktor fıkraları88"
O DA ONDAN,"Adamın birisi doktora gitmiş; “-Doktor Bey oğlum, sürekli başım ağrıyor.” Kısa bir mua - yeneden sonra doktor sormuş: “-Yaşın kaç amca?” “-82.” Doktor teşhisini açıklamış: “-Bu ağrılar ondan, amca.” demiş. Adam pek anlamamış, ama doktoru bulmuşken devam etmiş, “-Doktor oğlum, bazen sol böğrümde ağrılar hissediyo - rum.” Doktor: “-O da ondan, amca.” “-İdrar tutmada da çıkarmada da zorlanıyorum.” “-O da ondan.” “-Dizden aşağılarım yazın bile üşüyor.” “-O da ondan.” deyince, adam artık dayanamayıp patlamış: “-Sen ne biçim doktorsun! Okullarda ‘ondardır’dan başka bir şey öğretmediler mi! Doğru dürüst muayene bile etme - din!..” Doktor dinlemiş, dinlemiş, yaşlı müşterisinin söylenmesi biter gibi olunca demiş ki: “-Amca, sen şimdi bana çok öfkelendin ya, o da ondan!”"
AH BU AĞRILAR,"Yaşlı adam doktora, “- Sağ bacağımda müthiş bir ağrı var. Neden acaba?” “- Yaştan efendim, yaştan...” demiş doktor. Adam; “- Rica ederim doktor bey. Sol bacağım da aynı yaşta, ama o ağrımıyor!” kıssa tadında fıkralar89"
YEMEĞİN ALTINA MI ÜSTÜNE Mİ,"Adamın biri midesinde hissettiği aşırı ağrılar üzerine, dayana - maz doktora gider. Tahliller, muayene... ülser olduğuna teşhis konur. Reçetesini de yazan doktor, adama bir de ‘diyetisyenle görüşmesini’ söyler. Adam elindeki dokümanlarla diyet uzmanına geçer. Uzman gerekli incelemeyi yaptıktan sonra; “-Bu duruma göre en az altı ay kadar mideyi koruma altına almanız ve diyet prensiplerine sıkıca uymanız gerekecek. Yapılacakları yazılı olarak size vereceğim, ancak yine de yi - yeceklerinizi özetlemiş olayım; Haşlanmış veya beyaz et, haşlanmış yumurta, haşlanmış patates, karnabahar, lahana, ıspanak, pirinç, makarna, sütlü tatlılar, kabak tatlısı, yoğurt, kaşar veya beyaz peynir, elma, kiraz, çilek, böğürtlen...” Adam diyetisyeni can kulağıyla dinledikten sonra, uzmanın sözü bitince sormuş: “- Doktor Hanım, bunları yemeğin altına mı yiyeceğim, üstüne mi?”"
KISALTMA,"Hastanelerden birinde hasta dosyalarının kapağına hasta - lıklarının mahiyeti kısaca iki-üç harfle yazma uygulaması varmış. Mesela tüberküloz olanların dosyasında TB, pros - tat olanların dosyasında PRS işareti varmış. Genç bir dok - tor, incelediği birçok dosyada dikkatini çeken bir kısaltma bulup, bir eski meslektaşına sormuş: “-Üstat, şu dosyadaki harflerin hepsini anladım da, İAK ne - dir, onu söktüremedim.” Eski doktor cevap vermiş: “-O mu? O, ‘İşi Allaha Kalmış’ demektir arkadaşım.”  doktor fıkraları90 ""O gün herkes yaptığının karşılığını bulur ...""  Kehf S./17---------------------------------------------------------SSK SEVKLİSİ Adamın biri fazla kilolarından kurtulmak için doktora git - miş. Doktor ona bir kutu hap vermiş. 30 gün boyunca her gün bir tane almasını söylemiş. Adam evine gitmiş, akşam olduğunda bir hap alıp yatmış. Gece rüyasında futbol oynayan arkadaşlarını görmüş. He - men arkadaşlarının arasına katılmış. Bir oraya bir buraya koşturarak, goller atarak… yani futbol oynayarak sabah et - miş. Sabah kan ter için de uyanmış. Duş yapıp tartıldığında bir de bakmış ki, o gece bir kilo vermiş. Ertesi gün çok mutlu bir şekilde bir hap daha almış, yine sabaha kadar oyunlar oynamış. Sabah olunca yine kan ter içinde uyanmış. Tar - tıya çıktığında yine bir kilo daha verdiğini görmüş. Her gün aynı şekilde koşarken, oyunlar oynarken sabah ettiğinden 30 günün sonunda fazla olan 30 kilosunu atmış. Bunu, kendisi gibi kilolu bir arkadaşına anlatmış. Arkadaşı: “-Ben de kilo vermek istiyorum.” demiş ve  aynı doktora git - miş. Doktor ona da bir kutu hap vererek her gün bir tane almasını söylemiş. Gece olunca bir tane hap yutup yatmış. Ancak rüyasında kendisine kötü sözler söyleyerek üstüne doğru koşan bir grup korkunç adam görmüş. Sabaha kadar onlar kovalamış adam kaçmış. Sabah kan ter içinde uyan - mış. O da tartıldığında bir kilo verdiğini görmüş. Ertesi gece de sonraki gecelerde de aynı kabusu görmüş. Bütün gece - lerde o saldırganlardan kaçmış ve kan ter içinde bayılacak halde uyanmış. 30 günün sonunda o da 30 kilo vermiş. So - nunda doktorun yanına gitmiş ve doktora: “- Doktor Bey” demiş “Arkadaşıma bir hap verdiniz. O her gece güzel rüyalar görerek 30 kilo verdi. Ben de 30 kilo ver - dim ama her gece kaçmaktan bitap düşerek, kabuslar gö - rerek verdim. Neden böyle oldu?” demiş. Doktor demiş ki: “- O benim muayenehaneme gelen. özel hastamdı. Sen SGK sevklisi olarak hastaneye geldin.” kıssa tadında fıkralar91"
ORGANİZASYON HARİKA,"Adam camla parmağını kesmiş. Telaşla, yeni kurulan Aile Sağlık Merkezleri’nden birine gitmiş. İçeri girince karşısına iki kapı çıkmış.  Birinde “HASTALIKLAR” diğerinde “YARA - LANMALAR” yazıyormuş. Adam “Yaralanmalar” kapısından içeriye girmiş. Önünde yine iki kapı belirmiş. Birinde “KA - NAMALI” diğerinde “KANAMASIZ” yazıyor. “Kanamalı” ka - pıdan girince iki kapı daha. Bunların üzerinde de; “HAYATİ ÖNEMDE OLAN” ve “HAYATİ ÖNEMDE OLMAYAN” ibareleri varmış. Adam ‘HAYATİ ÖNEMDE OLMAYAN’ yazısı bulunan kapıyı açıp geçince kendini arka sokakta bulmuş. Evde sormuşlar: “-Sana iyi baktılar mı?” Adam cevap vermiş; “-Hiç bakmadılar, ama organizasyon harika idi.”"
BİR BİLMECE,"Soru: “Bir hastanın iyileşeceğini nasıl anlarsınız?” Cevap: “Çok basit... Nekahat devresini nerede geçireceğini sormaktan vaz geçip, doktorunun veya hastanenin fatura - sını nasıl ödeyeceğini düşünmeye başladığı zaman...”"
İLK AMELİYAT,"Ameliyat odasında genç doktor ile hastası konuşuyorlardı. Hasta; “- Aman doktor bey, çok korkuyorum! Ben ömrümde ilk defa ameliyat olacağım!” “- Korkacak bir şey yok. Bak ben korkuyor muyum? Halbuki ben de ömrümde ilk defa ameliyat yapacağım.” Azim ve sebat, insanların en büyük yardımcısıdır.  Hz. Ali--------------------------------------------------------- doktor fıkraları92"
TEŞEKKÜR,"Adam, hızlı hızlı merdivenleri tırmanıp doktorun yanına geldi ve dedi ki; “- Teşekkür ederim doktor bey. Tedavinizden çok memnun kaldım.” “- Ama siz benim hastam değilsiniz ki.” Adam güldü: “- Haklısınız doktor bey. Amcam sizin hastanızdı. Ve şimdi tüm serveti bana kaldı...”"
İYİ DOKTOR,"Adamin biri, arkadaşına sorar; “Tanıdığın, tavsiye edebileceğin iyi bir doktor var mı?” Arka - daşı cevap verir: “-Tanıdığım iyi bir doktor var; Rahmetli kaynanam, rahmetli kayınbiraderim, rahmetli amcam, rahmetli teyzem, rahmetli eniştem… hep ona giderlerdi.” Şerefle bitirilmesi gereken en ağır vazife, hayattır. Toequeville--------------------------------------------------------- kıssa tadında fıkralar93"
FIKRALARI, deli fıkraları94
DELİLİK İLE İLGİLİ TERİMLER,"DELİ NEDİR: Aklını yitirmiş olan, akli dengesi bozulmuş olan, mecnun. Davranışları aşırı ve taşkın olan (kimse), çılgın. ‘DELİ’ İLE EŞ VEYA YAKIN ANLAMLI TERİMLER AKILSIZ: Aklı, gerçeği görüp ona göre davranmayan, anlayışı kıt. Arapça kökenlidir. AKLINI KAÇIRMIŞ/AKLINI YİTİRMİŞ:  Delirmiş, gerek - siz, yersiz; akıl dışı, delice davranışlar sergileyen. Deli olmuş, çıldırmış. BAKIRKÖYLÜK:  Aklını yitirmiş, delirmiş. Not: ‘Bakırköy çok uzun yıllar, 1924-1940 arası Türkiye’nin ‘ilk ve tek akıl hastanesinin bulunduğu’ ilçe olması hasebiyle, edebiyatımızda ve günlük hayatımızda “deliliği çağrıştıran” bir kelime olarak kullanılır. DİVANE: Deli, kaçık, budala. Bir şeye çok düşkün olan. Farsça kökenlidir. GELGİT AKILLI:  Delice işler yapan, bir yaptığı bir yaptığını tutmayan, delişmen. KAÇIK:  Bazı davranışları dengesiz olan. MAZHAR OSMANLIK: kafayı yemiş, çıldırmış. Not: 1924 kuruluş çalışmalarından 1940 yılına kadar Bakırköy Akıl Hastanesi’nin Başhekimliği’ni yapan Nörolog- Psikolog Doktor Mazhar Osman (1884-1951), bir dönem ‘Bakırköy’ ismiyle bütünleşmiş, onun kadar meşhur olmuş ve ‘deliliği çağrıştıran’ bir isim olarak kullanılmıştır. kıssa tadında fıkralar95 TAHTASI EKSİK/ TAHTASI KIRIK:  Aklı tam olmayan, şaşkın, alık, budala. TIMARHANE KAÇKINI:  Delice işler yapan. ZIRDELİ:  Aşırı deli, çılgın."
DELİLİK LİTERATÜRÜNE GİREN KELİMELER,"AKIL:   Düşünme, anlama ve kavrama gücü. Öğüt, salık verilen yol.  Düşünce, kanı. Bellek. (Arapça kökenlidir.) ASAP :  Sinir. (Arapça kökenlidir). ASABİYE:  Sinir hastalıkları. BASİRET :  Gerçekleri yanılmadan görebilme yeteneği, uzağı görüş, seziş, anlayış, kavrayış, sağgörü, vizyon. (Arapça kökenlidir.) BELLEK:  Yaşananları, öğrenilen konuları, bunların geçmişle ilişkisini bilinçli olarak zihinde saklama gücü, dağarcık, akıl, hafıza, zihin. BEYİN:  Kafatasının içinde beyin zarları ile örtülü, iki yarım küre biçiminde sinir kütlesinden oluşan, duyum ve bilinç merkezlerinin bulunduğu organ, dimağ. CİNNET : Delilik. Çılgınlık (Arapça kökenlidir.) FİKİR:  Düşünce. Kuruntu. Bir konuyla ilgili olarak bilgi alıp bir görüş edinmek. (Birinden) bir konuyla ilgili olarak ne düşündüğünü sorup düşüncesinden yara - rlanmak. Bir konuda ne düşündüğünü bildirerek yol göstermek. Bir konuda yol gösterici bilgi edinmeyi sağlamak. (Arapça kökenlidir.) HAFIZA: Bellek (Arapça kökenlidir.) İDRAK:  Anlama yeteneği, anlayış, akıl erdirme. Erişme, deli fıkraları96 ulaşma. Algı. (Arapça kökenlidir.) NÖROLOJİ: Hastanelerde bulunan ve beyin, omuri - lik, sinir sitemi ile kas hastalıklarını inceleyen ve bu hastalıklara tedavi uygulayan bölüm. (Fransızca köken - lidir.) PSİKOLOG : Ruh bilimiyle uğraşan, bireylerin duygu, düşünce ve davranış süreçlerini inceleyen, teşhis ve tedavide görev alan ruhbilimci. (Latince kökenlidir.) PSİKİYATRİST : Ruh ve sinir hastalıklarında kişide görülen uyumsuzlukları önleme, teşhis ve teda - vide görev alan uzman doktor. Psikiyatrist, psikiyatri alanında uzmanlaşmış tıp doktorudur (Latince kökenli - dir.) PSİKOPAT :  Asosyal, empati yapmayan, vicdan azabı ve pişmanlık duymadan saldırganlık yapan, suça ve ahlak dışı davranışlara meyyal, sorumsuz, kibirli, çelişkili davranışlar sergileyen, düşük iradeli, bozuk kişilikli kişi. TIMARHANE: Akıl hastanesi. ZEKA:  İnsanın düşünme, akıl yürütme, objektif gerçekleri algılama, yargılama ve sonuç çıkarma yeteneklerinin tamamı, anlak, dirayet, feraset. (Arapça kökenlidir.) Allah Teala akıldan daha değerli bir şey yaratmamıştır. Hz. Muhammed--------------------------------------------------------- kıssa tadında fıkralar97"
DELİ Mİ AKILLI MI,"Bir bey ruh doktorunun kapısını çalıp içeri girdi. Kendisini tanıttı: “- Bendeniz Aksak Timur... Yani Timurlenk.” dedi. Ruh doktoru derhal yerinden doğruldu. Muayene odasının kapısını kapatıp hastanın yanına geldi. Bir iskemle çekip oturdu ve başladı konuşmaya: “- İnanın, kaç zamandır sizin gelmenizi bekliyordum... Şim - di başbaşa kaldık, sorayım bari: Allah aşkına ben Ankara savaşında ne hata işledim?”"
BEN SANA DELİ DERSEM,"Hastalardan biri, bir vesileyle Hastanenin Başhekimi Maz - har Osman’a: “-Sen delisin!” demiş. Mazhar Osman gülmüş; “-Senin, bana ‘deli demen’ önemli değil, ama ben sana bir kere ‘deli’ dersem buradan bir daha çıkamazsın!.” Allah Teala’ya en çok itaat eden, en çok akıllı olandır. Hz. Muhammed--------------------------------------------------------- deli fıkraları98"
